{
  "version": "0.5",
  "passportId": "ODP-2026-03-000555120",
  "title": "Executable Sculpture #2",
  "description": "Physical sculpture paired with executable realtime software.",
  "creationDate": "2026-01-30",
  "domain": "contemporary_art",
  "objectType": "mixed",
  "status": "prototype",
  "contentClass": "composite",
  "aiStatus": "assisted",
  "verificationMethod": "hybrid",
  "edition": { "model": "dynamic" },
  "authorship": {
    "author": {
      "name": "Example holder",
      "wallet": "0x742d35Cc6634C0532925a3b844Bc454e4438f44e",
      "creatorId": "C-482-930-174-005"
    },
    "coAuthors": [{ "name": "Collaborator A" }]
  },
  "year": 2026,
  "month": 3,
  "registeredAt": 1748000000,
  "registration": {
    "ianaTimeZone": "UTC",
    "localIso8601": "2026-03-22T18:30:45+00:00",
    "utcIso8601": "2026-03-22T18:30:45Z"
  },
  "currentState": {
    "location": "with_creator",
    "rightsNote": "Exhibition and documentation by agreement",
    "conditionNote": "Prototype electronics serviced 2026-03",
    "damageHistoryHash": "sha256:0011aa22bb33cc44dd55ee66ff778899aabbccddeeff00112233445566778899",
    "damageHistoryUrl": "https://artist.example/objects/executable-sculpture-2-condition-log.json"
  },
  "refinementTags": ["installation", "software", "sensor_based"],
  "image": {
    "url": "https://artist.example/works/executable-sculpture-2-main.jpg",
    "hash": "sha256:1122bb33cc44dd55ee66ff778899aabbccddeeff001122334455667788990011"
  },
  "physical": {
    "category": "object",
    "materials": [{ "name": "aluminium" }, { "name": "custom electronics" }],
    "marks": [{ "type": "label", "description": "Internal serial ES-2" }],
    "seal": {
      "numbered": {
        "number": "SL-00429831",
        "type": "holographic sticker"
      }
    }
  },
  "digital": {
    "subtype": "software",
    "format": "ZIP",
    "fileHash": "sha256:99aa77bb66cc55dd44ee33ff22110088aabbccddeeff001122334455667788aa",
    "fileSize": 148392810
  },
  "additionalMetadata": {
    "installationPower": "220V",
    "controllerVersion": "2.3.1"
  }
}
